<?xml version="1.0" encoding="UTF-8" ?>

<!ELEMENT glowny (podrzedny, podrzedny, podrzedny, podrzedny, podrzedny+,
                 pierwszy, pierwszy, pierwszy?, drugi, drugi, drugi?,
                 (
                 ((parzysty, parzysty)*)|(nieparzysty, (nieparzysty, nieparzysty)*)
                 )
                 )> 

<!ELEMENT podrzedny ANY>
<!ELEMENT pierwszy ANY>
<!ELEMENT drugi ANY>
<!ELEMENT parzysty ANY>
<!ELEMENT nieparzysty ANY>
