<?xml version='1.0' encoding='ISO-8859-2'?>
<!DOCTYPE glowny SYSTEM "zad.dtd">
<glowny>

	<podrzedny></podrzedny>
	<podrzedny></podrzedny>
	<podrzedny></podrzedny>
	<podrzedny></podrzedny>
	<podrzedny></podrzedny>

	<pierwszy></pierwszy>
	<pierwszy></pierwszy>
	<pierwszy></pierwszy>

	<drugi></drugi>
	<drugi></drugi>

	<parzysty></parzysty>
	<parzysty></parzysty>

</glowny>